{"type":"config","name":"Sherpa deterministic selection quality (real-eval labels)","metricName":"label_loss","metricUnit":"","bestDirection":"lower"}
{"run":431,"commit":"6ee227b","metric":0.7503,"metrics":{"missed_hit_rate":0.7241,"noise_leak_rate":0.4745,"label_loss_dev":0.783,"missed_hit_rate_dev":0.6364,"noise_leak_rate_dev":0.4194,"upstream_miss_rate":0.9329,"empty_top_rate":0.0661,"missed_pairs":58,"noise_pairs":137,"cases":242,"dev_cases":52},"status":"keep","description":"Baseline: deterministic selection benchmark over 242 real evaluated bundles (58 missed-pair, 137 noise-pair labels) replayed through postProcessCandidates.","timestamp":1788965529584,"segment":32,"confidence":null,"asi":{"hypothesis":"baseline measurement","benchmark":"bun bench/ranking-bench.ts replays frozen real candidate pools through postProcessCandidates and scores top-3 vs human missed/noise labels","ground_truth":"human frontmatter missed[]/noise[] from projects/kamil sherpa-evaluations (436 evals joined to 1068 traces)","limitation":"upstream_miss_rate=0.93 means 93% of human-labeled missed paths never entered the candidate pool; ranking cannot fix those, so the loop targets noise leakage + top-3 placement","dev_split":"20% hold-out by bundleId hash, monitoring only","next_action_hint":"attack noise_leak_rate=0.47 with general junk-path and focus-aware suppression rules; 65 leaks across 52 unique sources, 34 uncovered by obvious junk patterns"}}
{"run":432,"commit":"66334c9","metric":0.7138,"metrics":{"missed_hit_rate":0.7241,"noise_leak_rate":0.438,"label_loss_dev":0.783,"missed_hit_rate_dev":0.6364,"noise_leak_rate_dev":0.4194,"upstream_miss_rate":0.9329,"empty_top_rate":0.0744,"missed_pairs":58,"noise_pairs":137,"cases":242,"dev_cases":52},"status":"keep","description":"Add general machine-junk path patterns to global noise filter (caches, Go module cache, .ssh, node_modules, agent session dumps, .semgrep, logs/).","timestamp":1788965653203,"segment":32,"confidence":null,"asi":{"hypothesis":"Machine-junk paths (generic caches, Android SDK cache, Go module cache, .ssh, node_modules, agent session dumps, .semgrep state, logs/ dirs) leak into top-3 as noise and can be filtered globally without harming recall.","patterns_added":["\\.cache/","\\.android/cache/","go/pkg/mod/","\\.ssh/","node_modules/","agent/sessions/","\\.semgrep/","logs?/"],"generality":"all patterns are tool/ecosystem-generic, none fixture-specific","remaining_leaks":"52 unique leak sources at baseline; uncovered ones are focus-dependent artifacts (kb://journal, surreal://archivist-note, url_reference, bare directory routes, .pi/sherpa.config.json) needing focus-aware suppression next","next_action_hint":"add focus-aware suppression for low-value artifact classes: historical memory (kb://journal) and surreal archivist notes when history not requested, url_reference when web not planned, bare directory/route candidates"}}
{"run":433,"commit":"66334c9","metric":0.741,"metrics":{"missed_hit_rate":0.6897,"noise_leak_rate":0.4307,"label_loss_dev":0.783,"missed_hit_rate_dev":0.6364,"noise_leak_rate_dev":0.4194,"upstream_miss_rate":0.9329,"empty_top_rate":0.0868,"missed_pairs":58,"noise_pairs":137,"cases":242,"dev_cases":52},"status":"discard","description":"Focus-gate Sherpa self-artifacts (pi extensions, loops, sherpa traces) with hard filter + penalty — regressed label_loss.","timestamp":1788965736605,"segment":32,"confidence":3.924731182795707,"asi":{"discovery":"the same source can be a missed label in one bundle and a noise label in another, so self-artifact sources are genuinely relevant for some prompts","failure":"hard postProcessCandidates filter was too aggressive: missed_hit_rate fell 0.724->0.690 (lost 2 of 58 missed pairs) while noise_leak only improved 0.438->0.431","hypothesis":"Sherpa/Pi-agent self-artifacts (extension code, loops, traces) crowd out project context on unrelated prompts and should be focus-gated.","next_action_hint":"retry with soft ranking penalty only (drop the hard filter) so self-artifacts can still surface when nothing better exists"}}
{"run":434,"commit":"66334c9","metric":0.7138,"metrics":{"missed_hit_rate":0.7241,"noise_leak_rate":0.438,"label_loss_dev":0.783,"missed_hit_rate_dev":0.6364,"noise_leak_rate_dev":0.4194,"upstream_miss_rate":0.9329,"empty_top_rate":0.0744,"missed_pairs":58,"noise_pairs":137,"cases":242,"dev_cases":52},"status":"discard","description":"Soft self-artifact ranking penalty without hard filter — no metric change.","timestamp":1788966087479,"segment":32,"confidence":2.683823529411752,"asi":{"hypothesis":"soft self-artifact penalty (-1.2) without hard filter should demote self-artifacts below project context while keeping them available","result":"metric identical to best (0.7138) — penalty produced zero change in top-3 membership, so the leaked self-artifacts were already below the correspondence threshold or had no competing candidates in their pools","next_action_hint":"self-artifact demotion is a dead end on this fixture; pivot to curiosity://knowledge-gaps (6 leak instances), url_reference suppression when web not requested (6), and surreal_memory archivist notes (3)"}}
{"run":435,"commit":"5341447","metric":0.6382,"metrics":{"missed_hit_rate":0.7414,"noise_leak_rate":0.3796,"label_loss_dev":0.6862,"missed_hit_rate_dev":0.6364,"noise_leak_rate_dev":0.3226,"upstream_miss_rate":0.9329,"empty_top_rate":0.1033,"missed_pairs":58,"noise_pairs":137,"cases":242,"dev_cases":52},"status":"keep","description":"Suppress redundant URL echoes already present in the prompt and focus-gate surreal archivist notes.","timestamp":1788966217560,"segment":32,"confidence":4.121323529411764,"asi":{"discovery":"removing redundant/off-topic candidates also promoted known-missed items into top-3, so recall and precision improved together","generality":"both rules are principled: (1) a URL already typed in the prompt is redundant context, (2) surreal archivist notes need the same focus gating already applied to research/historical memory","hypothesis":"Two artifact classes are pure noise on unrelated prompts: url_reference items that merely echo a URL already in the focus, and surreal_memory archivist notes when the prompt is not about memory/knowledge.","label_evidence":"fixture shows url_reference noise=6 missed=0 and surreal_memory noise=7 missed=0","next_action_hint":"target remaining leak classes: curiosity://knowledge-gaps (6 leaks, currently unranked synthetic candidate), kb://journal historical memory (13 noise/0 missed), inquirer_memory (3/0), and file_snippet vs file preference (382 noise/0 missed for file_snippet)"}}
{"run":436,"commit":"664b517","metric":0.5433,"metrics":{"missed_hit_rate":0.7414,"noise_leak_rate":0.2847,"label_loss_dev":0.5572,"missed_hit_rate_dev":0.6364,"noise_leak_rate_dev":0.1935,"upstream_miss_rate":0.9329,"empty_top_rate":0.124,"missed_pairs":58,"noise_pairs":137,"cases":242,"dev_cases":52},"status":"keep","description":"Treat tool-state dot-directories as global noise (nvm, roo, antigravity, mtplx, 41d, .pi/understand-anything) + regression test.","timestamp":1788966307905,"segment":32,"confidence":6.499215070643643,"asi":{"discovery":"tool-state dot-directories account for ~12 of the remaining 52 top-3 noise leaks; the file_snippet artifact class is almost always noise on this corpus (noise=382, missed=0)","generality":"extends the existing enumerated GLOBAL_NOISY_SOURCE_PATTERNS list (.bun, .cdk/cache, .fallow, .pi/revolver) with more tool-state dirs; dev hold-out improved in the same direction (0.686 -> 0.557), which argues against pure fixture fitting, but the dir list is still machine-specific and should be reviewed before publishing","hypothesis":"Tool-state dot-directories (nvm, roo, antigravity, mtplx, 41d, .pi/understand-anything) are never project context and leak into top-3 as file_snippet noise.","next_action_hint":"remaining leaks: knowledge_gap 6, project_memory journal/wiki 5, self-artifacts 11+3, file_snippet home-root clutter, inquirer 2, doc_snippet 2; also watch empty_top_rate now at 0.124"}}
{"run":437,"commit":"664b517","metric":0.5433,"metrics":{"missed_hit_rate":0.7414,"noise_leak_rate":0.2847,"label_loss_dev":0.5572,"missed_hit_rate_dev":0.6364,"noise_leak_rate_dev":0.1935,"upstream_miss_rate":0.9329,"empty_top_rate":0.124,"missed_pairs":58,"noise_pairs":137,"cases":242,"dev_cases":52},"status":"discard","description":"Defer curiosity knowledge-gap meta-candidate to end of processed list — no metric change.","timestamp":1788966400614,"segment":32,"confidence":5.671232876712331,"asi":{"discovery":"all 6 knowledge_gap noise leaks are thin-pool cases (ranked out.length < 3), so deferring the gap still leaves it in top-3; 42/242 cases have a gap in top-3 and 30/242 have an empty top after filtering","hypothesis":"Synthetic curiosity://knowledge-gaps meta-candidate should never outrank source-grounded context in top-3, so defer it to the end of the processed list.","result":"metric unchanged (0.5433); deferral only helps when >=3 real items survive, which is not where the labeled leaks occur","next_action_hint":"thin-pool cases dominate the remaining failures: either raise recall by keeping one floor-quality candidate when filtering empties the pool, or attack the specific remaining noise classes (self-artifacts 15, project_memory 5, home-root file_snippet 6)"}}
{"run":438,"commit":"6cf0410","metric":0.5214,"metrics":{"missed_hit_rate":0.7414,"noise_leak_rate":0.2628,"label_loss_dev":0.5572,"missed_hit_rate_dev":0.6364,"noise_leak_rate_dev":0.1935,"upstream_miss_rate":0.9329,"empty_top_rate":0.1281,"missed_pairs":58,"noise_pairs":137,"cases":242,"dev_cases":52},"status":"keep","description":"Require explicit historical intent (drop bare 'session') before historical journal memory is eligible.","timestamp":1788966538411,"segment":32,"confidence":3.2864321608040177,"asi":{"discovery":"bare 'session' matched generic prompts about the current session, so journal entries leaked; explicit historical phrasing still admits real history prompts","hypothesis":"focusAllowsHistoricalMemory matched bare 'session', which most prompts mention; tightening it to explicit historical intent stops journal entries leaking as noise.","next_action_hint":"remaining leak classes: self-artifacts 15 (mostly prompts that mention the tool by name, so focus gating cannot fix them), project_memory wiki 2, home-root file_snippet 5, doc_snippet 2, inquirer 2; empty_top_rate now 0.128"}}
{"run":439,"commit":"e24f72c","metric":0.5068,"metrics":{"missed_hit_rate":0.7414,"noise_leak_rate":0.2482,"label_loss_dev":0.5572,"missed_hit_rate_dev":0.6364,"noise_leak_rate_dev":0.1935,"upstream_miss_rate":0.9329,"empty_top_rate":0.1281,"missed_pairs":58,"noise_pairs":137,"cases":242,"dev_cases":52},"status":"keep","description":"Focus-gate runtime log sources (.pi/loops run logs+specs, .pi-memory/sherpa-traces) so they only surface for log/trace/metrics/loop prompts.","timestamp":1788966760344,"segment":32,"confidence":2.565858798735511,"asi":{"discovery":"runtime log artifacts (.pi/loops, .pi-memory/sherpa-traces) leak into top-3 on prompts that merely paste tool output; they need the same focus gating as other diagnostic classes","hypothesis":"Sherpa/Pi runtime logs (loop run logs, loop specs, retrieval traces) are diagnostic artifacts and should only be injected when the prompt asks about logs/traces/metrics/loops.","next_action_hint":"remaining: self-artifacts 15 (prompts often name the tool, so keyword gating cannot fix), project_memory wiki 2, home-root file_snippet 5, doc_snippet 2, inquirer 2; also tested and rejected the empty-pool fallback (would gain +1 missed pair but leak +6 noise pairs)"}}
{"run":440,"commit":"0656f10","metric":0.4723,"metrics":{"missed_hit_rate":0.7759,"noise_leak_rate":0.2482,"label_loss_dev":0.4663,"missed_hit_rate_dev":0.7273,"noise_leak_rate_dev":0.1935,"upstream_miss_rate":0.9329,"empty_top_rate":0.1281,"missed_pairs":58,"noise_pairs":137,"cases":242,"dev_cases":52},"status":"keep","description":"Allow package manifests whose own package directory is named in the prompt, instead of requiring generic dependency keywords.","timestamp":1788966850190,"segment":32,"confidence":2.7470355731225298,"asi":{"discovery":"package manifests were being filtered out on code prompts even when the prompt named the package itself; the dev split improved in the same direction (missed_hit_dev 0.636 -> 0.727), a strong generalization signal","hypothesis":"A package manifest is on-topic when the prompt names its own package directory (e.g. focus mentions tdd_loop and candidate is .../tdd_loop/package.json), even without generic dependency keywords.","next_action_hint":"next recall bucket: doc_snippet items (census noise=3 vs missed=26) lose to file/pi_extension_file via the -0.25 wantsSource penalty; verify unique-label count before touching the penalty to avoid overfitting to one repeated research note"}}
{"run":441,"commit":"757d2d6","metric":0.4577,"metrics":{"missed_hit_rate":0.7759,"noise_leak_rate":0.2336,"label_loss_dev":0.4663,"missed_hit_rate_dev":0.7273,"noise_leak_rate_dev":0.1935,"upstream_miss_rate":0.9329,"empty_top_rate":0.157,"missed_pairs":58,"noise_pairs":137,"cases":242,"dev_cases":52},"status":"keep","description":"Require query-target lexical overlap for kb:// project_memory candidates (zero-overlap notes dropped).","timestamp":1788966995734,"segment":32,"confidence":3.41822429906542,"asi":{"discovery":"596 project_memory candidate instances in the fixture; 449 had zero query-target overlap, of which 12 were human-labeled noise and 0 were labeled missed","hypothesis":"kb:// durable memory notes with no lexical connection to the prompt are precision risk and can be dropped; semantic recall is handled upstream by the vector/inquirer stage.","next_action_hint":"empty_top_rate rose to 0.157 (+22.6%) as a side effect - verify on real use that zero-overlap kb memory is genuinely useless before publishing; remaining leaks are mostly pasted-log self-artifacts that resist keyword gating"}}
{"run":442,"commit":"68b624e","metric":0.4431,"metrics":{"missed_hit_rate":0.7759,"noise_leak_rate":0.219,"label_loss_dev":0.4663,"missed_hit_rate_dev":0.7273,"noise_leak_rate_dev":0.1935,"upstream_miss_rate":0.9329,"empty_top_rate":0.157,"missed_pairs":58,"noise_pairs":137,"cases":242,"dev_cases":52},"status":"keep","description":"Drop generic terms (context, tag/tags) from inquirer memory gating + regression test.","timestamp":1788967798077,"segment":32,"confidence":3.40387811634349,"asi":{"discovery":"both inquirer leaks matched only the generic term 'context' in pasted error blobs; empty-pool audit at 38 cases shows 2 missed pairs vs 53 noise pairs, so stricter filtering is still correct, not a recall regression","hypothesis":"'context' and 'tag/tags' are generic coding words, not memory-retrieval intent, and let vector inquirer memory into pasted-error prompts.","next_action_hint":"remaining leaks are pasted-log self-artifacts (pi-sherpa/index.ts, archivist/index.ts) whose prompts name the tool; a principled fix needs an intent signal rather than more keyword gating. Also consider svg/asset and self-config (.pi/sherpa.config.json) junk classes for a final small win"}}
{"run":443,"commit":"bd34144","metric":0.4285,"metrics":{"missed_hit_rate":0.7759,"noise_leak_rate":0.2044,"label_loss_dev":0.434,"missed_hit_rate_dev":0.7273,"noise_leak_rate_dev":0.1613,"upstream_miss_rate":0.9329,"empty_top_rate":0.1653,"missed_pairs":58,"noise_pairs":137,"cases":242,"dev_cases":52},"status":"keep","description":"Suppress image/binary assets globally, gate Sherpa's own config to Sherpa prompts, and drop bare-directory file_exact candidates.","timestamp":1788968035359,"segment":32,"confidence":3.390937829293994,"asi":{"discovery":"three small junk classes each had exactly 1 noise label and 0 missed labels: image assets, Sherpa's own config, and bare-directory file_exact candidates","hypothesis":"Image/binary assets, Sherpa's own .pi/sherpa.config.json, and bare-directory file_exact candidates are never useful text context and can be suppressed without recall cost.","rejected_hypothesis":"pasted-log-blob detection for self-artifacts: in log-blob focuses self-artifact candidates are missed 26 vs noise 42, so suppressing them would cost 0.45 missed_hit for 0.31 noise_leak - net worse","next_action_hint":"primary metric now 0.4285; recall at label ceiling and remaining precision leaks are minority self-artifacts. Consider consolidating the noise-filter list for publishability and reviewing machine-specific dirs before packaging"}}
{"run":444,"commit":"e08a43b","metric":0.4113,"metrics":{"missed_hit_rate":0.7931,"noise_leak_rate":0.2044,"label_loss_dev":0.434,"missed_hit_rate_dev":0.7273,"noise_leak_rate_dev":0.1613,"upstream_miss_rate":0.9329,"empty_top_rate":0.1653,"missed_pairs":58,"noise_pairs":137,"cases":242,"dev_cases":52},"status":"keep","description":"Cap 2 items per directory in the ranked output (context diversity) + ranking regression test.","timestamp":1788973512068,"segment":32,"confidence":3.511134127395132,"asi":{"discovery":"13 cases had all three top slots from one parent directory and the third item was never label-relevant; capping same-dir items promotes the next different-directory candidate","hypothesis":"Context diversity: spending all top slots on one directory wastes the budget; capping 2 items per directory (extras kept but pushed back) should promote other sources without losing anything.","next_action_hint":"primary metric 0.4113; recall residual is the 3 repeated docs and precision residual is minority self-artifacts, both label-ceiling limited. Stop benchmark tuning; next real steps are publishability cleanup (machine-specific noise dirs), re-baselining on fresh traces, and the open package-install decision"}}
{"run":445,"commit":"00b3504","metric":0.404,"metrics":{"missed_hit_rate":0.7931,"noise_leak_rate":0.1971,"label_loss_dev":0.434,"missed_hit_rate_dev":0.7273,"noise_leak_rate_dev":0.1613,"upstream_miss_rate":0.9329,"empty_top_rate":0.1777,"missed_pairs":58,"noise_pairs":137,"cases":242,"dev_cases":52},"status":"keep","description":"Treat foreign agent state (.claude/) as global noise and drop bare-directory file/file_snippet candidates.","timestamp":1788975135612,"segment":32,"confidence":3.727664155005382,"asi":{"discovery":"rejected a tempting knowledge_gap win as benchmark-gaming: dropping gaps in postProcessCandidates would score better but resolveModelFilterPool re-admits raw candidates when the filtered pool empties, so real thin-pool behavior would be unchanged","hypothesis":"Foreign agent tooling state (.claude/) is not project context, and file/file_snippet candidates that point at a bare directory (no filename) carry no content.","next_action_hint":"primary 0.4040; empty_top_rate 0.178 (verified twice: empty pools contain ~2 missed vs ~53 noise pairs, so filtering is correct). Remaining leaks are knowledge_gap thin pools (would be gaming to fix), repeated-doc recall, and self-artifacts the labels say are wanted elsewhere. Stop benchmark tuning; move to publishability cleanup and a fresh-trace re-baseline"}}
{"run":446,"commit":"00b3504","metric":0.404,"metrics":{"missed_hit_rate":0.7931,"noise_leak_rate":0.1971,"label_loss_dev":0.434,"missed_hit_rate_dev":0.7273,"noise_leak_rate_dev":0.1613,"upstream_miss_rate":0.9329,"empty_top_rate":0.1777,"missed_pairs":58,"noise_pairs":137,"cases":242,"dev_cases":52},"status":"discard","description":"Try removing/restricting the doc_snippet ranking penalty (KB docs missed 23 vs noise 3) — no metric change, root cause is upstream relevance.","timestamp":1788978411065,"segment":32,"confidence":3.6762208067940545,"asi":{"discovery":"the doc_snippet penalty only applies when wantsSource (isCodePrompt/isSourceLookupPrompt) is true, and every unhit doc_snippet miss occurs in non-code prompts such as 'review pi-sherpa context curation quality'; the penalty never binds, so removing it changes nothing","hypothesis":"The -0.25 doc_snippet wantsSource penalty is miscalibrated (KB docs labeled missed 23 vs noise 3) and should be removed or restricted to in-repo docs.","rejected_variants":["external-knowledge-only exemption (helper did not match repo://Documents/... relative paths)","full penalty removal (no-op for the miss cases, no noise change for code prompts)"],"next_action_hint":"the binding constraint for doc_snippet misses is the base retrieval relevance (0.45 vs 0.74-1.0 for competing files), i.e. upstream candidate scoring, not the ranking penalty; ranking-side levers are exhausted"}}
{"run":447,"commit":"1b28ff6","metric":0.3967,"metrics":{"missed_hit_rate":0.7931,"noise_leak_rate":0.1898,"label_loss_dev":0.434,"missed_hit_rate_dev":0.7273,"noise_leak_rate_dev":0.1613,"upstream_miss_rate":0.9329,"empty_top_rate":0.1942,"missed_pairs":58,"noise_pairs":137,"cases":242,"dev_cases":52},"status":"keep","description":"Require an explicit Sherpa mention before injecting Sherpa retrieval traces + ranking regression tests.","timestamp":1788978508879,"segment":32,"confidence":3.702617801047119,"asi":{"discovery":"the 3 remaining sherpa-trace leaks matched generic terms (log, trace provenance, bundle/loop) in prompts about other systems; requiring an explicit sherpa mention removes 2 of 3 while the one genuinely sherpa-specific case stays","hypothesis":"Sherpa's own retrieval traces are only meaningful for Sherpa-specific diagnostics; generic 'logs' or 'trace provenance' prompts concern other systems.","next_action_hint":"primary 0.3967; empty_top_rate 0.194 (still verified as correct filtering). Remaining ranking leaks are knowledge_gap thin pools (fixing would be gaming via resolveModelFilterPool) and self-artifacts the labels say are wanted elsewhere; ranking-side is exhausted, pivot to a candidate-generation benchmark for upstream_miss_rate=0.93"}}
