{"run":448,"commit":"1b28ff6","metric":0.3967,"metrics":{"missed_hit_rate":0.7931,"noise_leak_rate":0.1898,"label_loss_dev":0.434,"missed_hit_rate_dev":0.7273,"noise_leak_rate_dev":0.1613,"upstream_miss_rate":0.9329,"empty_top_rate":0.1942,"missed_pairs":58,"noise_pairs":137,"cases":242,"dev_cases":52},"status":"discard","description":"Give pi_extension_file the same code-file ranking bonus as repo files — no metric change.","timestamp":1788978671740,"segment":32,"confidence":4.3174603174603154,"asi":{"discovery":"pi_extension_file candidates already rank first in every case where they appear, so the code-file bonus changes nothing; pre-checked label census shows pi_extension_file is noise=0 missed=40, so it is valuable but not under-ranked","hypothesis":"Extension source files (pi_extension_file) are code and should receive the same wantsSource +0.35 preference as repo files.","next_action_hint":"third consecutive ranking no-op; ranking stage has no measurable headroom left. The remaining failures are upstream candidate generation (upstream_miss_rate=0.93) and would require a NEW benchmark axis plus init_experiment, not more ranking tweaks"}}
{"run":449,"commit":"556f95e","metric":0.3748,"metrics":{"missed_hit_rate":0.7931,"noise_leak_rate":0.1679,"label_loss_dev":0.4018,"missed_hit_rate_dev":0.7273,"noise_leak_rate_dev":0.129,"upstream_miss_rate":0.9329,"empty_top_rate":0.1983,"missed_pairs":58,"noise_pairs":137,"cases":242,"dev_cases":52},"status":"keep","description":"Focus-gate agent metadata indexes (catalog.csv, routes.csv/md) + ranking regression tests.","timestamp":1788978886155,"segment":32,"confidence":5.288732394366196,"asi":{"discovery":"catalog.csv/routes.csv/routes.md are agent-managed wiring files: 5 noise-labeled instances, 0 missed; also found 11 file_snippets in top-3 of which only 4 are noise-labeled, so a file_snippet penalty would mostly remove unlabeled items","hypothesis":"Agent-managed index/route tables (memory catalog, extension route map) describe the agent's own wiring, not the user's project, so they need focus gating like other self-artifacts.","next_action_hint":"primary 0.3748; dev noise_leak improved to 0.129. Remaining leaks: knowledge_gap thin pools (gaming to fix), pasted-log self-artifacts (labels say wanted elsewhere), generate-bonsai-image.sh and catalog leftovers now gated. Ranking genuinely near ceiling"}}
{"run":450,"commit":"556f95e","metric":0.3748,"metrics":{"missed_hit_rate":0.7931,"noise_leak_rate":0.1679,"label_loss_dev":0.4018,"missed_hit_rate_dev":0.7273,"noise_leak_rate_dev":0.129,"upstream_miss_rate":0.9329,"empty_top_rate":0.1983,"missed_pairs":58,"noise_pairs":137,"cases":242,"dev_cases":52},"status":"discard","description":"Focus-gate SKILL.md instruction files — no metric change (leaking prompts contain a 'Required skills:' section).","timestamp":1788979321641,"segment":32,"confidence":5.497803806734995,"asi":{"discovery":"the two leaking SKILL.md files appear in prompts that contain a 'Required skills:' section listing skill paths, so a keyword gate always allows them; the same prompts explicitly mention the leaking skill file yet the human still labeled it noise, so intent and mention cannot be separated with the current signals","hypothesis":"SKILL.md is the agent's own operating instruction and should only be injected when the prompt is about skills, not as general project knowledge.","next_action_hint":"4th consecutive ranking no-op/negative; all remaining leak classes are (a) knowledge_gap thin pools, (b) self-artifacts in prompts that name the tool, or (c) repeated/contradictory doc labels. Honest ranking headroom is exhausted; the only productive path is the candidate-generation benchmark (needs init_experiment) or the pending package-install decision"}}
{"run":451,"commit":"58f035e","metric":0.333,"metrics":{"missed_hit_rate":0.8276,"noise_leak_rate":0.1606,"label_loss_dev":0.4018,"missed_hit_rate_dev":0.7273,"noise_leak_rate_dev":0.129,"upstream_miss_rate":0.9329,"empty_top_rate":0.1983,"missed_pairs":58,"noise_pairs":137,"cases":242,"dev_cases":52},"status":"keep","description":"Defer pi_extension_route stubs behind content-bearing candidates + ranking regression test.","timestamp":1788980487378,"segment":32,"confidence":6.551020408163267,"asi":{"discovery":"simulated the change before coding it: deferring pi_extension_route to the end of the processed list predicted label_loss 0.333 / missed_hit 0.828 / noise_leak 0.161, and the real run matched exactly","hypothesis":"Directory/route stubs are pointers, not content; they should never outrank content-bearing candidates (files, docs, memory) in the top slots, but should remain available when nothing else matches.","next_action_hint":"primary 0.3330; recall 0.828. This confirms a general principle: content-bearing items outrank pointer/synthetic items. Check whether the same deferral helps other pointer classes (sherpa_trace_location, memory_index) via simulation before coding"}}
{"run":452,"commit":"7a18cea","metric":0.2322,"metrics":{"missed_hit_rate":0.9138,"noise_leak_rate":0.146,"label_loss_dev":0.2199,"missed_hit_rate_dev":0.9091,"noise_leak_rate_dev":0.129,"upstream_miss_rate":0.9329,"empty_top_rate":0.1983,"missed_pairs":58,"noise_pairs":137,"cases":242,"dev_cases":52},"status":"keep","description":"Kind diversity: cap code-type candidates at 2 of the top slots when a non-code candidate exists + regression test.","timestamp":1788980662315,"segment":32,"confidence":7.068212824010916,"asi":{"caveat":"gains trace to 2 unique docs (one is the repeated fix-sherpa research note); the rule is structural (kind diversity) rather than a doc boost, and the hold-out split improved strongly in the same direction (missed_hit_dev 0.727 -> 0.909), which argues against pure fixture fitting","discovery":"simulation matrix showed no single-type deferral helps (sherpa_trace_location worse, memory_index/git_status/file_snippet/knowledge_gap neutral), but capping the code kind to 2 of the top slots lets a relevant knowledge item enter without a blanket knowledge-first reorder","first_attempt":"unconditional code-kind cap broke the directory-diversity regression test on all-code pools; fixed by only applying the kind cap when a non-code candidate exists","hypothesis":"Context diversity should apply to kind, not just directory: code candidates must not monopolize all top slots when a relevant knowledge candidate is available.","next_action_hint":"primary 0.2322, recall 0.914, dev 0.220. Remaining misses are mostly the repeated docs now in top-3; remaining leaks are knowledge_gap thin pools and named self-artifacts. This is likely the practical ceiling of the ranking metric"}}
{"run":453,"commit":"7a18cea","metric":0.2322,"metrics":{"missed_hit_rate":0.9138,"noise_leak_rate":0.146,"label_loss_dev":0.2199,"missed_hit_rate_dev":0.9091,"noise_leak_rate_dev":0.129,"upstream_miss_rate":0.9329,"empty_top_rate":0.1983,"missed_pairs":58,"noise_pairs":137,"cases":242,"dev_cases":52},"status":"discard","description":"Cap durable-memory artifacts at one front slot — no metric change (simulation harness bug produced a false prediction).","timestamp":1788981678779,"segment":32,"confidence":7.585651537335289,"asi":{"discovery":"my simulation helper was buggy: capBy(fn, cap) applied the cap to every key, not just the target type, so 'cap project_memory at 1' actually capped all other types at 1 too and produced a false 0.2150 prediction; the real single-pass and two-pass memory-kind caps both measure 0.2322 (no-op)","hypothesis":"Durable-memory artifacts (project_memory/research_memory/inquirer_memory) are never labeled missed (project_memory: noise 13x, missed 0x) and should be capped at one in the front slots.","next_action_hint":"verify simulation transforms reproduce the intended rule before coding (e.g. assert the transform's output differs from identity on a synthetic pool); ranking metric likely at its practical ceiling at 0.2322"}}
{"run":454,"commit":"1eeb962","metric":0.1805,"metrics":{"missed_hit_rate":0.9655,"noise_leak_rate":0.146,"label_loss_dev":0.129,"missed_hit_rate_dev":1,"noise_leak_rate_dev":0.129,"upstream_miss_rate":0.9329,"empty_top_rate":0.1901,"missed_pairs":58,"noise_pairs":137,"cases":242,"dev_cases":52},"status":"keep","description":"Narrow the skill generic-source class to SKILL.md only, so skill-directory knowledge files are no longer skill-gated + golden test.","timestamp":1788981822504,"segment":32,"confidence":7.277139208173687,"asi":{"discovery":"genericSourceClass matched ANY path containing /.pi/agent/skills/, so non-instruction knowledge like m5sticks3/LESSONS.md was gated behind skill keywords even though it is labeled missed 3x / noise 0x; SKILL.md is the only true skill instruction file","hypothesis":"Only SKILL.md is the agent's operating instruction for a skill and needs skill intent; other files in a skill directory are ordinary knowledge.","next_action_hint":"primary 0.1805, recall 0.966, dev 0.129 (dev missed_hit = 1.0). Remaining misses ~2 pairs and remaining leaks are knowledge_gap thin pools + named self-artifacts. This is likely the ceiling; a fresh-trace re-baseline is the next honest check"}}
{"run":455,"commit":"d802bb0","metric":0.1732,"metrics":{"missed_hit_rate":0.9655,"noise_leak_rate":0.1387,"label_loss_dev":0.129,"missed_hit_rate_dev":1,"noise_leak_rate_dev":0.129,"upstream_miss_rate":0.9329,"empty_top_rate":0.1942,"missed_pairs":58,"noise_pairs":137,"cases":242,"dev_cases":52},"status":"keep","description":"Drop generic 'memory' from the surreal archivist-note gate + guard audit.","timestamp":1788981898076,"segment":32,"confidence":6.212055974165771,"asi":{"audit":"systematic guard audit over all 242 cases: no guard rejects a missed-labeled candidate any more except package manifests, which are already handled by focusMentionsPackageDir (#440); the over-gating bug class is exhausted","hypothesis":"'memory' is too generic a keyword for the surreal archivist-note gate (it matches Sherpa/memory-architecture prompts); surreal notes are noise 7x / missed 0x.","next_action_hint":"primary 0.1732, recall 0.966, dev 0.129. Remaining leaks: knowledge_gap 6 (gaming to fix), named self-artifacts 7, repeated doc_snippet 3, one-off script 2. Next honest check is a fresh-trace re-baseline rather than more keyword tuning"}}
{"run":456,"commit":"4ef7bef","metric":0.1659,"metrics":{"missed_hit_rate":0.9655,"noise_leak_rate":0.1314,"label_loss_dev":0.129,"missed_hit_rate_dev":1,"noise_leak_rate_dev":0.129,"upstream_miss_rate":0.9329,"empty_top_rate":0.1942,"missed_pairs":58,"noise_pairs":137,"cases":242,"dev_cases":52},"status":"keep","description":"Require trace/log/metrics intent (not just a Sherpa mention) for retrieval traces + regression test.","timestamp":1788983149429,"segment":32,"confidence":6.203821656050955,"asi":{"discovery":"pre-checked the single remaining trace leak: its focus matched only bundle/loop/loops (a sherpa-context dump), while the one missed trace pair matched 'metrics' + persisted; splitting trace intent from loop intent removes the leak with zero recall cost","hypothesis":"Retrieval traces are diagnostics about retrieval: they need both a Sherpa mention and trace/log/metrics intent; generic bundle/loop prompts are not trace questions.","next_action_hint":"primary 0.1659, recall 0.966, dev 0.129. Remaining leaks: knowledge_gap 6 (gaming to fix), named self-artifacts 6, repeated doc_snippet 3, one-off script 2. Simulated all deferral/cap variants - none win. Next honest step: fresh-trace re-baseline or stop"}}
{"run":457,"commit":"94d91ca","metric":0.1513,"metrics":{"missed_hit_rate":0.9655,"noise_leak_rate":0.1168,"label_loss_dev":0.129,"missed_hit_rate_dev":1,"noise_leak_rate_dev":0.129,"upstream_miss_rate":0.9329,"empty_top_rate":0.2066,"missed_pairs":58,"noise_pairs":137,"cases":242,"dev_cases":52},"status":"keep","description":"Exclude home-root clutter (depth-1 under $HOME) unless the prompt names the file + regression test.","timestamp":1788983258084,"segment":32,"confidence":5.440508628519528,"asi":{"discovery":"home-root files (depth-1 under $HOME) are 95 noise-labeled / 0 missed across the corpus; simulated the drop first and predicted ll 0.1513 / removed 4 items, and the real run matched exactly","hypothesis":"A file sitting directly in the user's home directory is container clutter, not project context; it should be excluded unless the prompt names the file.","next_action_hint":"primary 0.1513, recall 0.966, dev 0.129. Remaining leaks: knowledge_gap 6 (gaming to fix), named self-artifacts 6, repeated doc_snippet 3. empty_top_rate 0.207 (verified-correct). Ranking is at its practical ceiling; recommend fresh-trace re-baseline as the next evidence step"}}
{"run":458,"commit":"94d91ca","metric":0.1513,"metrics":{"missed_hit_rate":0.9655,"noise_leak_rate":0.1168,"label_loss_dev":0.129,"missed_hit_rate_dev":1,"noise_leak_rate_dev":0.129,"upstream_miss_rate":0.9329,"empty_top_rate":0.2066,"missed_pairs":58,"noise_pairs":137,"cases":242,"dev_cases":52},"status":"discard","description":"Normalize home prefix in parentDirKey for consistent directory-diversity keys — no metric change (latent robustness fix only).","timestamp":1788983350972,"segment":32,"confidence":4.803528468323978,"asi":{"discovery":"parentDirKey produces different keys for the same directory when stored absolute (/Users/kamil/.pi/agent/extensions/pi-sherpa -> agent/extensions/pi-sherpa) vs repo-relative (.pi/agent/... -> .pi/agent/extensions/pi-sherpa); normalizing the home prefix is a latent-robustness fix but a no-op on this fixture (the two forms never co-occur in one pool), and the empty-pool fallback was re-confirmed negative (50 empty pools: best candidate is noise 14x, missed 0x)","hypothesis":"Normalize absolute home paths in parentDirKey so directory diversity cannot be bypassed when the same directory appears in both absolute and repo-relative form.","next_action_hint":"metric unchanged at 0.1513; ranking levers exhausted. Next honest step is a fresh-trace re-baseline (new data, zero influence on the 28 decisions so far) rather than further keyword/parameter tuning"}}
{"run":459,"commit":"94d91ca","metric":0.1513,"metrics":{"missed_hit_rate":0.9655,"noise_leak_rate":0.1168,"label_loss_dev":0.129,"missed_hit_rate_dev":1,"noise_leak_rate_dev":0.129,"upstream_miss_rate":0.9329,"empty_top_rate":0.2066,"missed_pairs":58,"noise_pairs":137,"cases":242,"dev_cases":52},"status":"discard","description":"Build out-of-sample holdout harness and evaluate — holdout is contaminated (all 23 cases evaluated this session), so it cannot verify the gains; harness deferred to .auto/ideas.md.","timestamp":1788983564218,"segment":32,"confidence":4.300071787508974,"asi":{"discovery":"the only available holdout bundles were all evaluated during this same session, so they are contaminated: 23 cases, 73 missed labels, 70 upstream misses, 3 in-pool pairs all from the repeated autoresearch prompt; holdout_label_loss=1.0 is a session artifact, not evidence against the main-fixture gains","hypothesis":"Out-of-sample verification: build a holdout fixture from bundles excluded from bench/fixture.json and check whether the ranking gains transfer.","deferred":"harness plan and contamination finding recorded in .auto/ideas.md (preserved across revert); re-create build-holdout.py + ranking-bench-holdout.ts once bundles evaluated after this session exist","next_action_hint":"do not tune to the 3 holdout pairs (all one repeated prompt). Ranking metric remains 0.1513; next honest steps are candidate-generation benchmark (new metric, baseline ~0.07 recall) or waiting for fresh evaluation data"}}
{"type":"config","name":"Sherpa candidate-generation recall (deterministic file retrieval)","metricName":"retrieval_recall","metricUnit":"","bestDirection":"higher"}
{"run":460,"commit":"02aa3f2","metric":0.0053,"metrics":{"retrieval_noise_rate":0.0562,"retrieval_fallback_recall":0.0078,"retrieval_candidates_per_case":0.13,"retrieval_existing_labels":950,"retrieval_surfaced":5,"retrieval_noise_labels":89,"retrieval_fallback_labels":255,"retrieval_cases":305},"status":"keep","description":"Baseline for new candidate-generation benchmark: deterministic file retrieval surfaces only 5/950 existing human-labeled relevant paths (0.53%).","timestamp":1788983699103,"segment":33,"confidence":null,"asi":{"baseline":"retrieval_recall 0.0053 (5/950 existing missed labels surfaced); fallback recall 0.0078 (2/255); noise_rate 0.0562 (5/89); 0.13 candidates/case","hypothesis":"baseline for the new candidate-generation benchmark: the stage that ranking cannot fix","pivot_rationale":"ranking metric closed at 0.1513 after 29 experiments; upstream_miss_rate 0.93 (main) / 0.96 (holdout) is the dominant real-world failure, so the loop moved to a retrieval-stage metric","root_cause":"lib/rg.ts isUnsafeBroadSearchRoot() refuses os.homedir(); this workspace cwd IS the home dir, so indicator/routed/retry file searches return empty and candidate generation relies almost entirely on explicit paths in the prompt","anti_gaming":"retrieval_noise_rate and retrieval_candidates_per_case are tracked so a flooding recall gain is visible and rejectable","next_action_hint":"add a scoped search root for home-cwd workspaces (skip system/vendor dirs, cap depth) and measure retrieval_recall vs noise_rate/candidates-per-case"}}
{"run":461,"commit":"02aa3f2","metric":0.0316,"metrics":{"retrieval_noise_rate":0.1011,"retrieval_fallback_recall":0.0314,"retrieval_candidates_per_case":21.48,"retrieval_existing_labels":950,"retrieval_surfaced":30,"retrieval_noise_labels":89,"retrieval_fallback_labels":255,"retrieval_cases":305},"status":"checks_failed","description":"Enable scoped home-root rg search — recall 6x but candidates/case flooded 165x and checks failed (test encodes old home-unsafe policy).","timestamp":1788983837346,"segment":33,"confidence":null,"asi":{"discovery":"allowing home-root rg searches works (recall 0.0053 -> 0.0316, 6x) but is far too blunt: candidates/case 0.13 -> 21.48 (165x) and noise_rate 0.056 -> 0.101 (1.8x) — flooding, which the anti-gaming rule says to reject; also tests/parse-rg-output.test.ts:149 encodes the old policy (home is unsafe)","hypothesis":"The home-root rg bail-out is the mechanism behind 0.5% retrieval recall; allow scoped home searches with system/vendor excludes.","next_action_hint":"instead of content search over home, add a path/filename-based retrieval: rg --files with indicator-term matching on paths plus a hard result cap, then measure recall vs candidates/case and noise_rate","rejected":"broad home-root content search: recall gain accompanied by 165x candidate flooding and ~2x noise rate"}}
{"run":462,"commit":"84021d3","metric":0.1063,"metrics":{"retrieval_noise_rate":0.1348,"retrieval_fallback_recall":0.0706,"retrieval_candidates_per_case":19.15,"retrieval_existing_labels":950,"retrieval_surfaced":101,"retrieval_noise_labels":89,"retrieval_fallback_labels":255,"retrieval_cases":305},"status":"keep","description":"Scope home-root rg searches to the bounded Pi agent tree (~/.pi/agent) instead of bailing out; harden routeSkipsPath for missing skip. Recall 20x.","timestamp":1788984012995,"segment":33,"confidence":3.8403041825095054,"asi":{"anti_gaming_note":"candidates/case rose 0.13 -> 19.15 and noise_rate 0.056 -> 0.135. Judged NOT catastrophic: recall is 10.6% (not a return-everything win), the root is bounded (~2.5k files, 0.07s), and downstream postProcessCandidates caps the LLM pool at 12 with Stage-1 ranking (11.7% leak) filtering noise. Guard refined to: candidates/case must stay within the downstream budget (~<=24) and noise_rate <=~25%. Next experiment MUST add a recall@12 (post-ranking) metric to settle this empirically.","discovery":"72% of existing human-labeled missed paths (680/950) live under .pi/, and rg --files ~/.pi/agent lists only 2533 files in 0.07s, so scoping the home-root search to the Pi agent tree is cheap and high-yield","hypothesis":"A broad home root is unsearchable, but the Pi agent config/extension tree (~/.pi/agent) is bounded and is exactly what users ask about when working from the home directory; scope home-root searches there instead of bailing out.","next_action_hint":"add recall@12 after postProcessCandidates to the retrieval bench, then cap indicator candidates per case (top-N by match quality) to bring candidates/case down without losing recall"}}
{"run":463,"commit":"84021d3","metric":0.0432,"metrics":{"retrieval_recall_at_12":0.0389,"retrieval_noise_rate":0.1236,"retrieval_fallback_recall":0.0588,"retrieval_candidates_per_case":5.69,"retrieval_existing_labels":950,"retrieval_surfaced":41,"retrieval_surfaced_at_12":37,"retrieval_noise_labels":89,"retrieval_fallback_labels":255,"retrieval_cases":305},"status":"discard","description":"Cap indicator/retry file candidates by match quality (8/6) and add recall@12 metric — raw recall fell 0.1063→0.0432, but recall@12 shows only 37/950 labels survive into the model's pool.","timestamp":1788984178448,"segment":33,"confidence":5.329815303430079,"asi":{"discovery":"raw retrieval_recall over-counts: run #462 surfaced 101/950 labels but only 37/950 survived postProcessCandidates(...).slice(0,12), i.e. the candidates the model actually sees; most flooding is filtered downstream","hypothesis":"Cap indicator/retry candidates by indicator-hit quality (8/6) to cut volume without losing the recall that survives ranking.","next_action_hint":"re-init with retrieval_recall_at_12 as primary and re-apply the cap + quality ranking; plan recorded in .auto/ideas.md","rejected":"the cap cost raw recall 0.1063 -> 0.0432 while recall@12 stayed ~0.039, so as a raw-recall change it is a loss; the value is the metric correction, not the cap"}}
{"type":"config","name":"Sherpa retrieval recall@12 (labels surviving into the model's top-12)","metricName":"retrieval_recall_at_12","metricUnit":"","bestDirection":"higher"}
