{"run":464,"commit":"92999c8","metric":0.0695,"metrics":{"retrieval_recall":0.0863,"retrieval_noise_rate":0.1236,"retrieval_fallback_recall":0.051,"retrieval_candidates_per_case":19.15,"retrieval_existing_labels":950,"retrieval_surfaced":82,"retrieval_surfaced_at_12":66,"retrieval_noise_labels":89,"retrieval_fallback_labels":255,"retrieval_cases":305},"status":"keep","description":"Baseline for corrected retrieval metric: recall@12 0.0695 (66/950 relevant labels survive into the model's top-12); raw recall over-counts by ~20%.","timestamp":1788984341759,"segment":34,"confidence":null,"asi":{"baseline":"retrieval_recall_at_12 0.0695 (66/950); raw recall 0.0863 (82/950); noise_rate 0.1236; 19.15 candidates/case","metric_correction":"raw retrieval_recall over-counts: uncapped run #462 surfaced 82-101 labels but only 66-79 survive into the model's top-12; the cap experiment (#463) scored recall@12 0.0389, i.e. the cap was a loss on the corrected metric too","next_action_hint":"estimate the noise floor by re-running the baseline (observed run-to-run spread 0.0695 vs 0.0832 due to rg timeout/filesystem drift) before trusting small deltas; then target recall@12 with better indicator quality, not volume","variance_warning":"benchmark hits the live filesystem with a 3s rg timeout, so it is not deterministic; deltas below ~0.01 are likely noise"}}
{"run":465,"commit":"af4b475","metric":0.0716,"metrics":{"retrieval_recall":0.0905,"retrieval_noise_rate":0.1236,"retrieval_fallback_recall":0.0471,"retrieval_candidates_per_case":19.38,"retrieval_existing_labels":950,"retrieval_surfaced":86,"retrieval_surfaced_at_12":68,"retrieval_noise_labels":89,"retrieval_fallback_labels":255,"retrieval_cases":305},"status":"keep","description":"Raise rg search-term cap from 6 to 12 so more planner indicators are searched — recall@12 0.0695→0.0716 (+2 labels, within noise).","timestamp":1788984446669,"segment":34,"confidence":null,"asi":{"caveat":"the +2 labels (0.0695 -> 0.0716) is inside the observed run-to-run spread (~0.01); confirmation re-run queued before treating this as a real gain","hypothesis":"rg caps search terms at 6, but planner indicators usually list ~10; raising the cap to 12 covers more of the planner's own indicators at no extra cost.","next_action_hint":"re-run this config to confirm; if it holds, next lever is semantic coverage (Semble/memory sources are not measured by this bench at all), since lexical path/content matching is near its ceiling: only 12.3% of existing missed labels share a basename token with the prompt/indicators"}}
{"run":466,"commit":"af4b475","metric":0.0337,"metrics":{"retrieval_recall":0.0516,"retrieval_noise_rate":0.1236,"retrieval_fallback_recall":0.0314,"retrieval_candidates_per_case":19.38,"retrieval_existing_labels":950,"retrieval_surfaced":49,"retrieval_surfaced_at_12":32,"retrieval_noise_labels":89,"retrieval_fallback_labels":255,"retrieval_cases":305},"status":"discard","description":"Add --sort path to rg for deterministic output — two runs bit-identical (0.0337) but the fixed 30-match cap biases results, dropping recall@12 from 0.0716.","timestamp":1788984684382,"segment":34,"confidence":1,"asi":{"discovery":"ripgrep parallelizes traversal, so with a fixed first-N match cap the benchmark keeps a different subset every run: identical code scored recall@12 0.0695 / 0.0716 / 0.0926. --sort path makes two consecutive runs bit-identical (0.0337) but biases the first-30 selection toward early alphabetical paths and costs recall","hypothesis":"Adding --sort path to rg makes retrieval deterministic, stabilising the benchmark.","next_action_hint":"keep --sort path for determinism AND raise the match-parse cap (30 -> ~200) so truncation stops biasing results, then rank by indicator-hit quality; plan recorded in .auto/ideas.md","rejected":"determinism alone cost recall@12 0.0716 -> 0.0337 because the fixed 30-match cap then truncates systematically"}}
{"run":467,"commit":"a6e0f8a","metric":0.1326,"metrics":{"retrieval_recall":0.2589,"retrieval_noise_rate":0.2022,"retrieval_fallback_recall":0.1843,"retrieval_candidates_per_case":21.56,"retrieval_existing_labels":950,"retrieval_surfaced":246,"retrieval_surfaced_at_12":126,"retrieval_noise_labels":89,"retrieval_fallback_labels":255,"retrieval_cases":305},"status":"keep","description":"One match per distinct file (40) + deterministic rg --sort path — recall@12 0.0716→0.1326, raw 0.0905→0.2589, now reproducible.","timestamp":1788985241399,"segment":34,"confidence":3.329815303430079,"asi":{"determinism":"rg --sort path makes the benchmark reproducible: two consecutive runs both 0.1326 (previously identical code scored 0.0695/0.0716/0.0926)","discovery":"coverage beats depth: taking one match per distinct file (40 files) raised raw recall 0.0905 -> 0.2589 and recall@12 0.0716 -> 0.1326; ranking matches by indicator-term density (topMatchesByQuality) was much worse (0.0242) because term-dense files are large docs, not the relevant file","hypothesis":"Retrieval should maximize file coverage rather than line depth: dedupe rg matches by file and pass many distinct files, letting downstream ranking pick the top 12.","guards":"noise_rate 0.124 -> 0.202 (within the <=0.25 guard); candidates/case 19.4 -> 21.6 (within the ~24 budget)","next_action_hint":"noise_rate is now the binding guard; next improve candidate ranking quality for the noise classes, or extend the benchmark to semantic sources since lexical recall is at 0.26 raw / 0.13 at12"}}
{"run":38,"commit":"d8e2b28","metric":0.1379,"metrics":{"retrieval_recall":0.2695,"retrieval_noise_rate":0.1798,"retrieval_fallback_recall":0.1843,"retrieval_candidates_per_case":20.09,"retrieval_existing_labels":950,"retrieval_surfaced":256,"retrieval_surfaced_at_12":131,"retrieval_noise_labels":89,"retrieval_fallback_labels":255,"retrieval_cases":305},"status":"keep","description":"Exclude loop run logs and Sherpa caches from the search — recall@12 0.1326→0.1379, noise_rate 0.202→0.180, deterministic.","timestamp":1788985633479,"segment":2,"confidence":1.804749340369393,"asi":{"determinism":"two consecutive runs bit-identical (0.1379)","discovery":"loop run logs/specs occupied 30 of 2023 top-12 slots and some raw noise; excluding them from the search freed slots for relevant files (recall@12 +5 labels) and lowered noise_rate","hypothesis":"Loop run logs/specs (.pi/loops) and Sherpa's own caches (.pi/sherpa) are diagnostic artifacts that match indicator terms and crowd top-12 slots; exclude them from the search.","next_action_hint":"lexical ceiling is near: raw recall 0.2695, at12 0.1379. Next lever is the semantic sources (Semble/memory) which the bench does not yet measure; alternatively increase distinct-file cap 40 -> 60 and watch noise_rate (now 0.180 vs 0.25 guard)"}}
{"run":39,"commit":"d8e2b28","metric":0.1379,"metrics":{"retrieval_recall":0.2695,"retrieval_noise_rate":0.1798,"retrieval_fallback_recall":0.1843,"retrieval_candidates_per_case":21.4,"retrieval_existing_labels":950,"retrieval_surfaced":256,"retrieval_surfaced_at_12":131,"retrieval_noise_labels":89,"retrieval_fallback_labels":255,"retrieval_cases":305},"status":"discard","description":"Raise distinct-file cap 40→60 — no recall change, just more candidates; cap already saturates coverage.","timestamp":1788985789309,"segment":2,"confidence":2,"asi":{"discovery":"the 40-file cap already saturates useful coverage: raising it to 60 added ~6% more candidates (20.09 -> 21.40/case) but surfaced zero additional relevant labels and no additional noise","hypothesis":"Raising the distinct-file cap from 40 to 60 increases coverage and recall@12.","next_action_hint":"lexical retrieval is saturated at recall@12 0.1379 / raw 0.2695; the remaining ~73% of misses are semantic (no token overlap), so the next real lever is extending the benchmark to Semble/memory sources rather than tuning lexical caps"}}
{"run":40,"commit":"d8e2b28","metric":0.1347,"metrics":{"retrieval_recall":0.2495,"retrieval_noise_rate":0.1798,"retrieval_fallback_recall":0.1725,"retrieval_candidates_per_case":18.42,"retrieval_existing_labels":950,"retrieval_surfaced":237,"retrieval_surfaced_at_12":128,"retrieval_noise_labels":89,"retrieval_fallback_labels":255,"retrieval_cases":305},"status":"discard","description":"Case-insensitive rg search (-i) — slightly worse: extra matches displaced relevant files under the first-40-by-path selection.","timestamp":1788986006175,"segment":2,"confidence":12.90566037735849,"asi":{"discovery":"case-insensitive matching changed the match set and, because selection is 'first 40 distinct files in --sort path order', extra matches displaced relevant files: raw recall 0.2695 -> 0.2495, recall@12 0.1379 -> 0.1347, candidates/case 20.09 -> 18.42","hypothesis":"rg is case-sensitive by default, so casing differences (Sherpa/sherpa, OpenAI/openai) silently drop files; add -i.","next_action_hint":"the bottleneck is now the SELECTION order among matches, not the match set. Next: order distinct-file matches by match strength (path contains an indicator term first, then content matches) instead of pure --sort path order"}}
{"run":41,"commit":"d8e2b28","metric":0.1368,"metrics":{"retrieval_recall":0.2674,"retrieval_noise_rate":0.1798,"retrieval_fallback_recall":0.1765,"retrieval_candidates_per_case":20.09,"retrieval_existing_labels":950,"retrieval_surfaced":254,"retrieval_surfaced_at_12":130,"retrieval_noise_labels":89,"retrieval_fallback_labels":255,"retrieval_cases":305},"status":"discard","description":"Order matches by path-strength before content matches — no gain (recall@12 0.1379→0.1368).","timestamp":1788986187106,"segment":2,"confidence":16.094117647058805,"asi":{"discovery":"path-strength ordering is a wash: recall@12 0.1379 -> 0.1368 (130 vs 131 labels), raw 0.2695 -> 0.2674, noise and volume unchanged — the deterministic path order was already as good as this heuristic","hypothesis":"Order distinct-file matches by strength: files whose path contains an indicator term before content-only matches.","next_action_hint":"lexical slice is saturated after 13 experiments (0.0053 -> 0.1379). Remaining ~86% of labels have no token overlap with the prompt. Next real step: add a semantic retrieval source (semble) and extend the bench to measure it, or accept Stage 2 as done and return to the open package-install decision"}}
